{
  "agent_lanes": [
    "edge_case"
  ],
  "canonical_source_hash_after": "76f879482d549f833d106e517014b24eff5c408cd9098e03001de0710f09f3c7",
  "canonical_source_hash_before": "76f879482d549f833d106e517014b24eff5c408cd9098e03001de0710f09f3c7",
  "canonical_source_mutated": false,
  "completed_at": "2026-05-21T20:58:25.105871Z",
  "receipt_count": 6,
  "sandbox_run_id": "SR-external-source",
  "schema_version": "SandboxRun.v1",
  "source_ref": "local",
  "started_at": "2026-05-21T20:58:25.099488Z",
  "status": "completed",
  "target_repo": "example-repo",
  "workspace_path": "sandbox/workspaces/SR-external-source/example-repo"
}