{
  "agent_lanes": [
    "edge_case"
  ],
  "completed_at": "2026-05-05T01:50:07.263411Z",
  "receipt_count": 6,
  "sandbox_run_id": "SR-a63546096e",
  "schema_version": "SandboxRun.v1",
  "source_ref": "demo",
  "started_at": "2026-05-05T01:50:07.258278Z",
  "status": "completed",
  "target_repo": "example-repo",
  "workspace_path": "sandbox/workspaces/SR-a63546096e/example-repo"
}